text,cleaned text
"‘I’m alone all day every day. I’m beyond lonely. I feel completely isolated from society. I feel like my life is over because of my illness. However, when I’m in the hospital, I have the opportunity to talk to many different people. It makes for a pleasant change for me’.","‘I’m alone all day every day. I’m beyond lonely. I feel completely isolated from society. I feel like my life is over because of my illness. However, when I’m in the hospital, I have the opportunity to talk to many different people. It makes for a pleasant change for me’."
‘Every day I go to a local grocery store just to talk to the people working there. This is the only time I get to talk to other people. I enjoy it because they care about me and advise me not to eat too many sugary foods. This makes me feel good. I voluntarily told them I have diabetes’.,‘Every day I go to a local grocery store just to talk to the people working there. This is the only time I get to talk to other people. I enjoy it because they care about me and advise me not to eat too many sugary foods. This makes me feel good. I voluntarily told them I have diabetes’.
"‘I can’t tell my staff that I have type 2 diabetes. If I did, they would think that our company would become bankrupt, and so they would leave it. Diabetes is one of those illnesses that give other people anxiety. Whenever I need to go to the hospital, I just tell them I’ve got a cold or something. It’s better just to lie like that’. ","‘I can’t tell my staff that I have type 2 diabetes. If I did, they would think that our company would become bankrupt, and so they would leave it. Diabetes is one of those illnesses that give other people anxiety. Whenever I need to go to the hospital, I just tell them I’ve got a cold or something. It’s better just to lie like that’. "
‘I can’t help thinking that I’ll never be able to work as a regular full-time employee’.,‘I can’t help thinking that I’ll never be able to work as a regular full-time employee’.
"‘Because of my diabetes, I don’t think I can get married. Wouldn’t having diabetes be an obstacle to marriage, especially for my partner? It’s hard enough telling her that I have diabetes’.","‘Because of my diabetes, I don’t think I can get married. Wouldn’t having diabetes be an obstacle to marriage, especially for my partner? It’s hard enough telling her that I have diabetes’."
"‘I don’t have any diabetes-related complications yet. However, despite this I quit my job. I used to work for a call center, which involved sitting at a desk all day long. This working environment really raised my blood sugar levels. Because of exactly this I stopped working to really focus on my treatment. Health is more important than work, right?! I wish to get another type of job once I have improved my condition’.","‘I don’t have any diabetes-related complications yet. However, despite this I quit my job. I used to work for a call center, which involved sitting at a desk all day long. This working environment really raised my blood sugar levels. Because of exactly this I stopped working to really focus on my treatment. Health is more important than work, right?! I wish to get another type of job once I have improved my condition’."
"‘There is some prejudice toward people with type 2 diabetes in the workplace. The possibility that someone at work could find out that I have diabetes scares me. If that happened, some parents would call the school board asking if it’s okay for someone with diabetes to continue to work as a school principle’. ","‘There is some prejudice toward people with type 2 diabetes in the workplace. The possibility that someone at work could find out that I have diabetes scares me. If that happened, some parents would call the school board asking if it’s okay for someone with diabetes to continue to work as a school principle’. "
"‘As long as I work, I would like to act the same way normal people do, I mean, healthy people. I don’t feel like I am disabled while working with them. Because I have diabetes, I can’t work as much? I don’t want to tell them such things! I also don’t want them to see me like that either’.","‘As long as I work, I would like to act the same way normal people do, I mean, healthy people. I don’t feel like I am disabled while working with them. Because I have diabetes, I can’t work as much? I don’t want to tell them such things! I also don’t want them to see me like that either’."
‘I don’t want people at work to see me as less hard-working’. ,‘I don’t want people at work to see me as less hard-working’. 
"""I don’t want anyone to see the medication. I don’t like taking it in front of anyone. For me, the biggest problem is when I go to a business dinner. Then, I find it really difficult to find the time to take my medication. In that situation, I don’t take it. It’s really important to me that no one sees me taking my medication, so skipping it doesn’t bother me’.","I don’t want anyone to see the medication. I don’t like taking it in front of anyone. For me, the biggest problem is when I go to a business dinner. Then, I find it really difficult to find the time to take my medication. In that situation, I don’t take it. It’s really important to me that no one sees me taking my medication, so skipping it doesn’t bother me’."
"‘It is said that diabetes is a “luxury disease” caused by laziness, and so this always seems to be the main focus of personal criticism.’","‘It is said that diabetes is a luxury disease caused by laziness, and so this always seems to be the main focus of personal criticism.’"
"‘To me, diabetes is a real burden. I want to rid myself of this illness. I have often been told that it’s not curable, so I need to think about how I can live with it for the rest of my life. I wish it would disappear.’","‘To me, diabetes is a real burden. I want to rid myself of this illness. I have often been told that it’s not curable, so I need to think about how I can live with it for the rest of my life. I wish it would disappear.’"
"“You said the word: failing. It's touching me too because I think that I'm also failing because when I don't follow my diet, when I don't eat right and I know better.”","You said the word: failing. Its touching me too because I think that Im also failing because when I dont follow my diet, when I dont eat right and I know better."
"“It makes me depressed when I think I'm not doing what I need to do, when I eat the wrong plate of food, ‘look what I did to myself!’ Now, I'm going to feel sick. Sometimes I feel nauseous. I get low in energy and okay, I didn't do it the right way, now look at the outcome.”","It makes me depressed when I think Im not doing what I need to do, when I eat the wrong plate of food, ‘look what I did to myself!’ Now, Im going to feel sick. Sometimes I feel nauseous. I get low in energy and okay, I didnt do it the right way, now look at the outcome."
"“You say something is wrong, they want to write a freaking prescription. Like, come on!”","You say something is wrong, they want to write a freaking prescription. Like, come on!"
"“You get pushed in, you get pushed out. That's all.”","You get pushed in, you get pushed out. Thats all."
"“I grew up in an era where people were shooting drugs. So for me, needles were taboo. I'm supposed to take [insulin] with me. I don't even carry it… I'd rather go home. I don't care if I'm [away from home]. I'll go home to inject myself and go back [out].”","I grew up in an era where people were shooting drugs. So for me, needles were taboo. Im supposed to take [insulin] with me. I dont even carry it… Id rather go home. I dont care if Im [away from home]. Ill go home to inject myself and go back [out]."
"“I got one coworker [who says], 'You know you're not supposed to have that. Don't give her that.' That's annoying.”","I got one coworker [who says], You know youre not supposed to have that. Dont give her that. Thats annoying."
"“When I eat something right away I worry [that] I'm eating the wrong thing, my sugar's going to be up, I'm hurting myself. What is it doing? Is it causing nerve damage right now? Is it in the future going to do something?”","When I eat something right away I worry [that] Im eating the wrong thing, my sugars going to be up, Im hurting myself. What is it doing? Is it causing nerve damage right now? Is it in the future going to do something?"
"""I don’t want to have to inject in front of them [strangers]. I think people do still find it a bit strange. It’s not heroin but it’s still a bit odd.""",I don’t want to have to inject in front of them [strangers]. I think people do still find it a bit strange. It’s not heroin but it’s still a bit odd.
"People can see it, I think that’s the worst thing ","People can see it, I think that’s the worst thing "
"""All my friends are on Facebook and I don’t want them to see that I have diabetes. Other people are probably like, ‘I don’t care if people see I have diabetes’. That’s why I wouldn’t join those groups [support groups]. With me, half the people I’m liking on Facebook wouldn’t have a clue that I have it.""","All my friends are on Facebook and I don’t want them to see that I have diabetes. Other people are probably like, ‘I don’t care if people see I have diabetes’. That’s why I wouldn’t join those groups [support groups]. With me, half the people I’m liking on Facebook wouldn’t have a clue that I have it."
It is kind of hard with working. You don’t want to be taking out a diary and writing down and people looking at you. I feel a bit uncomfortable. I don’t know the people that well inside there. In a new work environment I’d feel a bit uncomfortable. In my old work I would have cared less. I would have gone off and sat down for as long as I needed ,It is kind of hard with working. You don’t want to be taking out a diary and writing down and people looking at you. I feel a bit uncomfortable. I don’t know the people that well inside there. In a new work environment I’d feel a bit uncomfortable. In my old work I would have cared less. I would have gone off and sat down for as long as I needed 
"That’s something that drives me crazy, Type 1 and 2 diabetes. It makes me so annoyed. Type 1 diabetes, you don’t get it because you’re overweight. People are like, ‘oh which kind do you have? Do you have the really bad kind?’ I’m like, ‘what do you mean by that?’ Or they’re like, ‘oh I’m sorry, did you eat too many sweets?’ Of course that’s why I have it","That’s something that drives me crazy, Type 1 and 2 diabetes. It makes me so annoyed. Type 1 diabetes, you don’t get it because you’re overweight. People are like, ‘oh which kind do you have? Do you have the really bad kind?’ I’m like, ‘what do you mean by that?’ Or they’re like, ‘oh I’m sorry, did you eat too many sweets?’ Of course that’s why I have it"
We didn’t bring diabetes on ourselves. We didn’t have a choice. The majority of Type 2 s have a choice and they chose not to do what they should be doing. You feel like you’re branded with the same brush as them ,We didn’t bring diabetes on ourselves. We didn’t have a choice. The majority of Type 2 s have a choice and they chose not to do what they should be doing. You feel like you’re branded with the same brush as them 
I really do think that Type 1 gets left behind. Even yesterday was world diabetes day and on the news it was all oh ‘if you improve your lifestyle and if you do this and that’ you improve your risk and I’m there shouting ‘this is Type 2 diabetes’!,I really do think that Type 1 gets left behind. Even yesterday was world diabetes day and on the news it was all oh ‘if you improve your lifestyle and if you do this and that’ you improve your risk and I’m there shouting ‘this is Type 2 diabetes’!
I hadn’t drank for years because I didn’t know how with the diabetes. I didn’t go to festivals with my friends because I didn’t know what would happen with my diabetes there ,I hadn’t drank for years because I didn’t know how with the diabetes. I didn’t go to festivals with my friends because I didn’t know what would happen with my diabetes there 
"No one understood how frustrating it can be sometimes when you’re doing your damndest to get it right and it’s not working. Because it’s your health on the line, it can be very upsetting ","No one understood how frustrating it can be sometimes when you’re doing your damndest to get it right and it’s not working. Because it’s your health on the line, it can be very upsetting "
I felt guilty because I knew I should have been stricter than I was. It was my own fault for my levels being high ,I felt guilty because I knew I should have been stricter than I was. It was my own fault for my levels being high 
"People like, articles and news reports tend to go with worse case scenarios and it’s scary. There are sometimes when I do get stressed out about it. There was one programme and they had some poor guy and he lost half a foot. I was like ‘Jesus Christ’. Then there was some poor woman and while they were filming it she died. I was like ‘holy crap’. It was very extreme. I don’t want to be told that by the time I get to 60 I’m going to have one leg and be blind. ","People like, articles and news reports tend to go with worse case scenarios and it’s scary. There are sometimes when I do get stressed out about it. There was one programme and they had some poor guy and he lost half a foot. I was like ‘Jesus Christ’. Then there was some poor woman and while they were filming it she died. I was like ‘holy crap’. It was very extreme. I don’t want to be told that by the time I get to 60 I’m going to have one leg and be blind. "
You go in and see the registrar and they don’t know who you are. You don’t feel open or comfortable talking to him about how you’re getting on. I think seeing the same person helps big time (,You go in and see the registrar and they don’t know who you are. You don’t feel open or comfortable talking to him about how you’re getting on. I think seeing the same person helps big time (
There was one or two doctors that made flying visits in and out and didn’t really treat you like a patient. It was more like you’re a file. They just have a quick look at the file and look at numbers without discussing any of the issues with you,There was one or two doctors that made flying visits in and out and didn’t really treat you like a patient. It was more like you’re a file. They just have a quick look at the file and look at numbers without discussing any of the issues with you
"I went on holidays in August and my aunt texted me to say there was an article in the Irish Times to say diabetics shouldn’t wear sandals because of the risk to their feet. I was like, have a bit of common sense. I was so annoyed over that. I was like, have a bit of tact","I went on holidays in August and my aunt texted me to say there was an article in the Irish Times to say diabetics shouldn’t wear sandals because of the risk to their feet. I was like, have a bit of common sense. I was so annoyed over that. I was like, have a bit of tact"
"I just get anxious and over think things. At the weekend it would be like, I kind of spend most of the day in bed. Just because I skip meals and then sometimes I just go out and buy junk and stay in my room. I could go home to my family but then I end up getting stressed out down there. Just anxiety and stress ","I just get anxious and over think things. At the weekend it would be like, I kind of spend most of the day in bed. Just because I skip meals and then sometimes I just go out and buy junk and stay in my room. I could go home to my family but then I end up getting stressed out down there. Just anxiety and stress "
"“They know I’m diabetic, but that’s it, they never asked anything about it or what to do.”","They know I’m diabetic, but that’s it, they never asked anything about it or what to do."
"“At work I get lots of ‘well why do you need to go now (to doctor or hospital) can’t you do it after work, why can’t you do it on your day off (Sunday) ”","At work I get lots of ‘well why do you need to go now (to doctor or hospital) can’t you do it after work, why can’t you do it on your day off (Sunday) "
"“I went to work after a hypo and they (colleagues) said ‘Cor, you look rubbish’, ‘Cor you look ill have you been drinking?’ and you just want to be left alone to get back to normal. People who don’t understand, umm, I find come up with statements like ooh you shouldn’t be eating that should you? cos it’s got sugar in.” ","I went to work after a hypo and they (colleagues) said ‘Cor, you look rubbish’, ‘Cor you look ill have you been drinking?’ and you just want to be left alone to get back to normal. People who don’t understand, umm, I find come up with statements like ooh you shouldn’t be eating that should you? cos it’s got sugar in. "
"“I worked with a very bigoted woman who didn’t want me to do my pen injections at my desk… She wanted me to go into the toilets and do it and I fought my corner and said ‘Actually, no – a sterile piece of medical equipment that I’m trying to put into me, in a really stinky, unhygienic toilet?” ","I worked with a very bigoted woman who didn’t want me to do my pen injections at my desk… She wanted me to go into the toilets and do it and I fought my corner and said ‘Actually, no – a sterile piece of medical equipment that I’m trying to put into me, in a really stinky, unhygienic toilet? "
"“If I say to people, ‘oh, I've also got type 2 diabetes now’, I feel that I'd be judged because they would feel that ‘well it's obvious because you can see that she gained weight’…”","If I say to people, ‘oh, Ive also got type 2 diabetes now’, I feel that Id be judged because they would feel that ‘well its obvious because you can see that she gained weight’…"
"“People just think, well, you know…You must have done something wrong; but you think yourself, I've done everything right and I've still got it, then is there some other factor that contributed towards it? That's what it is.”","People just think, well, you know…You must have done something wrong; but you think yourself, Ive done everything right and Ive still got it, then is there some other factor that contributed towards it? Thats what it is."
"“There is almost a label attached to the diagnosis, that you don't look after yourself and eat the wrong things, which really is not the case.”","There is almost a label attached to the diagnosis, that you dont look after yourself and eat the wrong things, which really is not the case."
"“You know, if you ever say to people, you've got it [type 2 diabetes], there's this kind of, um… we talk about all the sort of stigmas and the discrimination that's out there. I think there's an unspoken discrimination of people that are obese.”","You know, if you ever say to people, youve got it [type 2 diabetes], theres this kind of, um… we talk about all the sort of stigmas and the discrimination thats out there. I think theres an unspoken discrimination of people that are obese."
"“Another impact is dealing with the stereotypical assumptions people make once they find out you're not a “real diabetic” this makes me feel so annoyed. I didn't set out to give myself diabetes, unfortunately it chooses me.” ","Another impact is dealing with the stereotypical assumptions people make once they find out youre not a real diabetic this makes me feel so annoyed. I didnt set out to give myself diabetes, unfortunately it chooses me. "
"“There's also the day to day, sort of, ‘you've done this to yourself…because it's one of those- ‘it's your own fault’…”","Theres also the day to day, sort of, ‘youve done this to yourself…because its one of those- ‘its your own fault’…"
" “I think I told a couple of close friends, but I was really ashamed because there is that whole sort of ‘you're very young to be getting this,’ so I didn't tell many people."," I think I told a couple of close friends, but I was really ashamed because there is that whole sort of ‘youre very young to be getting this,’ so I didnt tell many people."
 “Isolation is an issue as I feel unable to engage in the same social activities as my friends.” , Isolation is an issue as I feel unable to engage in the same social activities as my friends. 
“I have struggled to value myself in the same way after being diagnosed with this condition [type 2 diabetes]. I have not been able to find a secure relationship since and feel lonely.”,I have struggled to value myself in the same way after being diagnosed with this condition [type 2 diabetes]. I have not been able to find a secure relationship since and feel lonely.
"“My practice nurse I found her patronising. She keeps saying “No you have to do it this way! to do it this way!” not understanding that you know, the way I am eating. I've been doing it for my life, and it [diabetes] changed all what I do, the way I function. She just thinks it's easy to stop eating. If I try and explain she doesn't want to listen to me.”","My practice nurse I found her patronising. She keeps saying No you have to do it this way! to do it this way! not understanding that you know, the way I am eating. Ive been doing it for my life, and it [diabetes] changed all what I do, the way I function. She just thinks its easy to stop eating. If I try and explain she doesnt want to listen to me."
"“If your sugar goes high, they won't say: “Yeah, I'll work with you. Let's see why it's high. Because it was low last time.” They will say to you, here you go have an extra tablet.”","If your sugar goes high, they wont say: Yeah, Ill work with you. Lets see why its high. Because it was low last time. They will say to you, here you go have an extra tablet."
" “It didn't matter how many times I said “this doesn't help, this doesn't work for me”. It was sort of ignored… So, listening. Because every time I went, they would tell me, you know, “oh, just carry on taking it [medication], it's good, it's fine”, and nobody listened, and I ended up just not taking it.”"," It didnt matter how many times I said this doesnt help, this doesnt work for me. It was sort of ignored… So, listening. Because every time I went, they would tell me, you know, oh, just carry on taking it [medication], its good, its fine, and nobody listened, and I ended up just not taking it."
“My diabetes nurse and diabetes midwife were too focused on my diabetes rather than my mental well-being and did not offer much support.”,My diabetes nurse and diabetes midwife were too focused on my diabetes rather than my mental well-being and did not offer much support.
" “I think the way the doctor told me—it wasn't even like, ‘sit down, we need to have a chat about your latest results’. It was almost like, ‘oh, by the way, you know you're diabetic now, right?’ I don't think it was very sensitively handled.”"," I think the way the doctor told me—it wasnt even like, ‘sit down, we need to have a chat about your latest results’. It was almost like, ‘oh, by the way, you know youre diabetic now, right?’ I dont think it was very sensitively handled."
"“So just, with sensitivity…Like with gentleness, and with an understanding that the person you're telling is probably going to find that quite distressing. Whereas I think a lot of the doctors I've spoken to have been very blunt, and have not really taken into account that, you know, it's scary for people.”","So just, with sensitivity…Like with gentleness, and with an understanding that the person youre telling is probably going to find that quite distressing. Whereas I think a lot of the doctors Ive spoken to have been very blunt, and have not really taken into account that, you know, its scary for people."
"Usually people say, oh, you must have had a bad lifestyle, something or whatever, which may be true sometimes, but it’s not the only reason, so...","Usually people say, oh, you must have had a bad lifestyle, something or whatever, which may be true sometimes, but it’s not the only reason, so..."
"You know, and again, they took me off shifts, because I couldn’t remember if I’d taken my pills one week, you know? One week, I’m working early and next week, I’m working late, and then I’m working nights, and I used to go, I can’t remember if I’ve taken them or not. My manager said, that’s no use, is it?","You know, and again, they took me off shifts, because I couldn’t remember if I’d taken my pills one week, you know? One week, I’m working early and next week, I’m working late, and then I’m working nights, and I used to go, I can’t remember if I’ve taken them or not. My manager said, that’s no use, is it?"
"Because we're talking about food; I mean, I go to my family, and when I say I can't eat that food, they usually think that's disrespecting them, so you've got all that as well to deal with.","Because were talking about food; I mean, I go to my family, and when I say I cant eat that food, they usually think thats disrespecting them, so youve got all that as well to deal with."
